{
  "$schema": "https://json-schema.org/draft/2020-12/schema",
  "$id": "https://grandchallenge.ai/schemas/active-version-reconciliation-receipt-1.0.0.json",
  "title": "Exact GH-OS active-version reconciliation receipt",
  "type": "object",
  "additionalProperties": false,
  "required": ["schema_version", "operation_id", "status", "contradictions", "review_packet", "reviewed_source_heads", "protected_merges", "reconciliation_merge", "current_status_projection", "claim_boundaries"],
  "properties": {
    "$schema": {"const": "../schemas/active_version_reconciliation_receipt.schema.json"},
    "schema_version": {"const": "1.0.0"},
    "operation_id": {"const": "GCL-GHOS-ACTIVE-VERSION-RECONCILIATION-001"},
    "status": {"enum": ["candidate_awaiting_protected_readback", "coherent_on_protected_main"]},
    "contradictions": {
      "type": "object", "additionalProperties": false,
      "required": ["open_count", "closed_ids"],
      "properties": {
        "open_count": {"const": 0},
        "closed_ids": {"type": "array", "uniqueItems": true, "minItems": 9,
          "contains": {"const": "VAL-01"},
          "items": {"enum": ["SC-01", "SC-02", "SC-03", "SC-04", "SC-05", "SC-06", "SC-07", "SC-08", "VAL-01"]}}
      }
    },
    "review_packet": {
      "type": "object", "additionalProperties": false,
      "required": ["campaign", "packet_sha256", "governing_issue_disposition_url"],
      "properties": {
        "campaign": {"const": "GCL-GHOS-ACTIVE-VERSION-RECONCILIATION-001"},
        "packet_sha256": {"type": "string", "pattern": "^[0-9a-f]{64}$"},
        "governing_issue_disposition_url": {"type": "string", "format": "uri"}
      }
    },
    "reviewed_source_heads": {
      "type": "object", "additionalProperties": false,
      "required": ["intellect", "gcl_standards"],
      "properties": {
        "intellect": {"type": "string", "pattern": "^[0-9a-f]{40}$"},
        "gcl_standards": {"type": "string", "pattern": "^[0-9a-f]{40}$"}
      }
    },
    "protected_merges": {
      "type": "object", "additionalProperties": false,
      "required": ["gcl_integration", "gcl_adoption", "intellect_projection", "github_profile"],
      "properties": {
        "gcl_integration": {"type": "string", "pattern": "^[0-9a-f]{40}$"},
        "gcl_adoption": {"type": "string", "pattern": "^[0-9a-f]{40}$"},
        "intellect_projection": {"type": "string", "pattern": "^[0-9a-f]{40}$"},
        "github_profile": {"type": "string", "pattern": "^[0-9a-f]{40}$"}
      }
    },
    "reconciliation_merge": {"oneOf": [{"type": "null"}, {"type": "string", "pattern": "^[0-9a-f]{40}$"}]},
    "current_status_projection": {
      "type": "object", "additionalProperties": false,
      "required": ["path", "git_blob_sha1"],
      "properties": {
        "path": {"const": "status/GCL-GHOS-00-current.json"},
        "git_blob_sha1": {"type": "string", "pattern": "^[0-9a-f]{40}$"}
      }
    },
    "claim_boundaries": {
      "type": "object", "additionalProperties": false,
      "required": ["constitutional_claim_authorized", "organization_wide_conformance_authorized", "production_claim_authorized", "mathematical_claim_authorized", "certification_claim_authorized", "novelty_claim_authorized", "deployment_claim_authorized", "commercial_claim_authorized"],
      "properties": {
        "constitutional_claim_authorized": {"const": false},
        "organization_wide_conformance_authorized": {"const": false},
        "production_claim_authorized": {"const": false},
        "mathematical_claim_authorized": {"const": false},
        "certification_claim_authorized": {"const": false},
        "novelty_claim_authorized": {"const": false},
        "deployment_claim_authorized": {"const": false},
        "commercial_claim_authorized": {"const": false}
      }
    }
  },
  "allOf": [
    {"if": {"properties": {"status": {"const": "candidate_awaiting_protected_readback"}}}, "then": {"properties": {"reconciliation_merge": {"type": "null"}}}},
    {"if": {"properties": {"status": {"const": "coherent_on_protected_main"}}}, "then": {"properties": {"reconciliation_merge": {"type": "string", "pattern": "^[0-9a-f]{40}$"}}}}
  ]
}
